{
    "project": "iot-digital-twin",
    "region": "us-east-1",
    "device_id": "core2-aws-001",
    "thing_name": "core2-aws-001",
    "mqtt_topic": "devices/core2-aws-001/telemetry",
    "iot_rule_name": "core2-aws-001-ingest-rule",
    "ingest_lambda_name": "iot-digital-twin-ingest",
    "latest_state_table_name": "iot-digital-twin-latest-state",
    "twinmaker_workspace_name": "iot-digital-twin-demo-workspace",
    "twinmaker_entity_name": "core2-aws-001-entity",
    "twinmaker_component_name": "core2-aws-001-component",
    "twinmaker_component_type": "core2-aws-001",
    "telemetry_rate_hz": 1.0,
    "offline_timeout_seconds": 30,
    "max_clock_skew_seconds": 10,
    "cloudwatch_log_retention_days": 14,
    "device_certificate_authoritative": true,
    "device_id_is_data_only": true,
    "reject_device_authored_offline": true,
    "connectivity_state_server_derived": true,
    "server_replay_and_stale_enforcement": true,
    "max_retry_attempts": 0,
    "least_privilege_iam": true,
    "no_broad_permission_fallback": true,
    "tags": {
        "Environment": "dev",
        "Project": "iot-digital-twin",
        "Owner": "human-review-required"
    }
}